<?xml version="1.0" encoding="UTF-8"?>
<bank xmlns:xsi="http://www.w3.org/2001/XMLSchema-instance"
      xsi:schemaLocation="http://acme-bank.com/bank bank-schema.xsd">
  
  <accounts>
    <savings_account id="a1" interest="0.03" xmlns="http://acme-bank.com/bank/savings">
      <balance>2500</balance>
    </savings_account>   
    <savings_account id="a2" interest="0.03" xmlns="http://acme-bank.com/bank/savings">
      <balance>15075</balance>
    </savings_account>  
    <checking_account id="a3" xmlns="http://acme-bank.com/bank/checking">
      <balance>4025</balance>
    </checking_account>
    <checking_account id="a4" xmlns="http://acme-bank.com/bank/checking">
      <balance>-125</balance>
    </checking_account>
    <checking_account id="a5" xmlns="http://acme-bank.com/bank/checking">
      <balance>325</balance>
    </checking_account>  
  </accounts>

  <customers>
    <customer id="c1">
      <name>Ben Richerdson</name>
      <address>Park Drive 2</address>
    </customer>
    <customer id="c2">
      <name>Marc Wretcher</name>
      <address>Mill Drive 75</address>
    </customer>
    <customer id="c3">
      <name>Angel Steady</name>
      <address>Lake Sight 15</address>
    </customer>
  </customers>
  
  <customer_accounts>
    <customer_account c_id="c1" ac_id="a2"/>
    <customer_account c_id="c1" ac_id="a3"/>
    <customer_account c_id="c2" ac_id="a4"/>
    <customer_account c_id="c3" ac_id="a1"/>
    <customer_account c_id="c3" ac_id="a5"/>
  </customer_accounts>
  
</bank>
